Super Category,Category,Term,Definition,,
Unit 6 - Political Socialization,Extended,Concensus,General agreement among the citizenry on an issue.,,
Unit 6 - Political Socialization,Extended,Divisive opinion,Public opinion that is polarized between two quite different opinions.,,
Unit 6 - Political Socialization,Extended,Agenda setting,Determining which public policy questions will be debated or considered.,,
Unit 6 - Political Socialization,Extended,Media,Channels of mass communication.,,
Unit 6 - Political Socialization,Extended,Political Trust,The population's confidence in the government.,,
Unit 6 - Political Socialization,Extended,Public Opinion,The aggregate of individual attitudes or beliefs by some portion of the adult population.,,
Unit 6 - Political Socialization,Extended,Sampling Error,The difference between a sample's results and the true result if the entire population had been interviewed.,,
Unit 6 - Political Socialization,Extended,Watergate Break-in; Watergate Scandal; Watergate,President Nixon's administration broke into the Democratic National Committee headquarters at the Watergate Office Building.,,
Unit 7 - Interest Groups,Core,Interest groups,An organized group of individuals sharing common objectives who actively attempt to influence policymakers.,,
Unit 7 - Interest Groups,Core,Lobbyist,An organization or individual who attempts to influence legislation and the administrative decisions of government.,,
Unit 7 - Interest Groups,Core,Social movement,"A movement that represents the demands of a large segment of the public for political, economic, or social change.",,
Unit 7 - Interest Groups,Core,Free Rider Problem,The difficulty interest groups face in recruiting members when the benefits they achieve can be gained without joining the group.,,
Unit 7 - Interest Groups,Core,Solidary Incentive; Solidary,A reason or motive for supporting or participating in the activities of a group based on the desire to associate with others and to share with others a particular interest or hobby.,,
Unit 7 - Interest Groups,Core,Material Incentive; Material,A reason or motive for supporting or participating in the activities of a group based on economic benefits or opportunities.,,
Unit 7 - Interest Groups,Core,Purposive Incentive; Purposive,A reason for supporting or participating in the activities of a group based on agreement with the goals of the group. ,,
Unit 7 - Interest Groups,Core,Labor Movement,"Generally, the economic and political expression of working-class interests; politically, the organization of working-class interests.",,
Unit 7 - Interest Groups,Core,Direct Technique; Direct,An interest group activity that involves interaction with government officials to further the group's goals.,,
Unit 7 - Interest Groups,Core,Indirect Technique; Indirect,A strategy employed by interest groups that uses third parties to influence government officials.,,
Unit 7 - Interest Groups,Core,Climate Control,"The use of public relations techniques to create favorable public opinion toward an interest group, industry, or corporation.",,
Unit 7 - Interest Groups,Core,Boycott,A form of pressure or protest—an organized refusal to purchase a particular product or deal with a particular business.,,
Unit 7 - Interest Groups,Extended,Latent Interests,Public-policy interests that are not recognized or addressed by a group at a particular time.,,
Unit 7 - Interest Groups,Extended,Service sector,"The sector of the economy that provides services—such as health care, banking, and education—in contrast to the sector that produces goods.",,
Unit 7 - Interest Groups,Extended,Public Interest,"The best interests of the overall community; the national good, rather than the narrow interests of a particular group.",,
Unit 7 - Interest Groups,Extended,Home style politician; Home style,A politician that represents the people.,,
Unit 7 - Interest Groups,Extended,Hill style politician; Hill style,A politician that pursues personal interests and represents lobbyist.,,
Unit 7 - Interest Groups,Extended,Lobbying Disclosure Act; LDA,"An act passed in 1995 that created, among other things, a comprehensive reporting and disclosure structure for lobbyists, prohibited the spending of federal money on lobbying, and, in some cases, limited the percent of spending that can go to lobbying.",,